{
  "schemaVersion": 1,
  "corpusId": "autonomous-activation-v1",
  "policyVersion": "skillwire-activation-v1",
  "catalogRelease": "activation-catalog-v1",
  "localInventoryVersion": "activation-local-v1",
  "cases": [
    {
      "id": "auto-dependency-upgrade-planning-1",
      "scenarioClass": "automatic-relevant",
      "prompt": "Plan a major framework dependency upgrade with compatibility research, migration checkpoints, rollback, and verification.",
      "explicitUserIntent": false,
      "invocationContext": "automatic",
      "expectedCatalogMatch": {
        "skillId": "dependency-upgrade-planning",
        "revision": "1.0.0",
        "revisionSha256": "b93eb2b23120b134df66b2adda7a7f94f12743ac6678369bf61561d923e4f599"
      },
      "expectedBehavior": {
        "search": "call",
        "load": "call",
        "operationSequence": ["search_skills", "load_skill"],
        "maxSearchCalls": 1,
        "maxLoadCalls": 1,
        "maxResourceCalls": 0,
        "resourcePaths": [],
        "repositoryHashProvided": false,
        "expectedMemoryWrites": 0,
        "expectedOutcomeWrites": 0,
        "terminalReason": "instructions-sufficient"
      },
      "rationale": "Specialized dependency-upgrade-planning task with a frozen automatic-eligible match."
    },
    {
      "id": "auto-dependency-upgrade-planning-2",
      "scenarioClass": "automatic-relevant",
      "prompt": "Create a dependency version migration plan that covers breaking changes, tests, and rollback.",
      "explicitUserIntent": false,
      "invocationContext": "automatic",
      "expectedCatalogMatch": {
        "skillId": "dependency-upgrade-planning",
        "revision": "1.0.0",
        "revisionSha256": "b93eb2b23120b134df66b2adda7a7f94f12743ac6678369bf61561d923e4f599"
      },
      "expectedBehavior": {
        "search": "call",
        "load": "call",
        "operationSequence": ["search_skills", "load_skill"],
        "maxSearchCalls": 1,
        "maxLoadCalls": 1,
        "maxResourceCalls": 0,
        "resourcePaths": [],
        "repositoryHashProvided": false,
        "expectedMemoryWrites": 0,
        "expectedOutcomeWrites": 0,
        "terminalReason": "instructions-sufficient"
      },
      "rationale": "Specialized dependency-upgrade-planning task with a frozen automatic-eligible match."
    },
    {
      "id": "auto-dependency-upgrade-planning-3",
      "scenarioClass": "automatic-relevant",
      "prompt": "Review this planned library upgrade for compatibility risks and a safe staged rollout.",
      "explicitUserIntent": false,
      "invocationContext": "automatic",
      "expectedCatalogMatch": {
        "skillId": "dependency-upgrade-planning",
        "revision": "1.0.0",
        "revisionSha256": "b93eb2b23120b134df66b2adda7a7f94f12743ac6678369bf61561d923e4f599"
      },
      "expectedBehavior": {
        "search": "call",
        "load": "call",
        "operationSequence": [
          "search_skills",
          "load_skill",
          "read_skill_resource"
        ],
        "maxSearchCalls": 1,
        "maxLoadCalls": 1,
        "maxResourceCalls": 1,
        "resourcePaths": ["references/upgrade-checklist.md"],
        "repositoryHashProvided": false,
        "expectedMemoryWrites": 0,
        "expectedOutcomeWrites": 0,
        "terminalReason": "resource-consumed"
      },
      "rationale": "Specialized dependency-upgrade-planning task with a frozen automatic-eligible match."
    },
    {
      "id": "auto-dockerfile-hardening-1",
      "scenarioClass": "automatic-relevant",
      "prompt": "Perform a Dockerfile hardening review for minimal images, least privilege, reproducibility, and secret safety.",
      "explicitUserIntent": false,
      "invocationContext": "automatic",
      "expectedCatalogMatch": {
        "skillId": "dockerfile-hardening",
        "revision": "1.0.0",
        "revisionSha256": "9a3f4ae15465afb34e89e7035316dc4b36bdbe4bcb9a3900a48dafcc37281f0d"
      },
      "expectedBehavior": {
        "search": "call",
        "load": "call",
        "operationSequence": ["search_skills", "load_skill"],
        "maxSearchCalls": 1,
        "maxLoadCalls": 1,
        "maxResourceCalls": 0,
        "resourcePaths": [],
        "repositoryHashProvided": false,
        "expectedMemoryWrites": 0,
        "expectedOutcomeWrites": 0,
        "terminalReason": "instructions-sufficient"
      },
      "rationale": "Specialized dockerfile-hardening task with a frozen automatic-eligible match."
    },
    {
      "id": "auto-dockerfile-hardening-2",
      "scenarioClass": "automatic-relevant",
      "prompt": "Design a container security checklist covering non-root execution and reproducible builds.",
      "explicitUserIntent": false,
      "invocationContext": "automatic",
      "expectedCatalogMatch": {
        "skillId": "dockerfile-hardening",
        "revision": "1.0.0",
        "revisionSha256": "9a3f4ae15465afb34e89e7035316dc4b36bdbe4bcb9a3900a48dafcc37281f0d"
      },
      "expectedBehavior": {
        "search": "call",
        "load": "call",
        "operationSequence": ["search_skills", "load_skill"],
        "maxSearchCalls": 1,
        "maxLoadCalls": 1,
        "maxResourceCalls": 0,
        "resourcePaths": [],
        "repositoryHashProvided": false,
        "expectedMemoryWrites": 0,
        "expectedOutcomeWrites": 0,
        "terminalReason": "instructions-sufficient"
      },
      "rationale": "Specialized dockerfile-hardening task with a frozen automatic-eligible match."
    },
    {
      "id": "auto-dockerfile-hardening-3",
      "scenarioClass": "automatic-relevant",
      "prompt": "Review a production image build for Dockerfile hardening and credential leakage risks.",
      "explicitUserIntent": false,
      "invocationContext": "automatic",
      "expectedCatalogMatch": {
        "skillId": "dockerfile-hardening",
        "revision": "1.0.0",
        "revisionSha256": "9a3f4ae15465afb34e89e7035316dc4b36bdbe4bcb9a3900a48dafcc37281f0d"
      },
      "expectedBehavior": {
        "search": "call",
        "load": "call",
        "operationSequence": [
          "search_skills",
          "load_skill",
          "read_skill_resource"
        ],
        "maxSearchCalls": 1,
        "maxLoadCalls": 1,
        "maxResourceCalls": 1,
        "resourcePaths": ["references/hardening-checklist.md"],
        "repositoryHashProvided": false,
        "expectedMemoryWrites": 0,
        "expectedOutcomeWrites": 0,
        "terminalReason": "resource-consumed"
      },
      "rationale": "Specialized dockerfile-hardening task with a frozen automatic-eligible match."
    },
    {
      "id": "auto-github-actions-ci-1",
      "scenarioClass": "automatic-relevant",
      "prompt": "Design a maintainable GitHub Actions CI workflow with validation and delivery stages.",
      "explicitUserIntent": false,
      "invocationContext": "automatic",
      "expectedCatalogMatch": {
        "skillId": "github-actions-ci",
        "revision": "1.0.0",
        "revisionSha256": "6c5a32f336100a147b3af865f8a14713bd7f82a2810e1666ee49a679bef2c45c"
      },
      "expectedBehavior": {
        "search": "call",
        "load": "call",
        "operationSequence": ["search_skills", "load_skill"],
        "maxSearchCalls": 1,
        "maxLoadCalls": 1,
        "maxResourceCalls": 0,
        "resourcePaths": [],
        "repositoryHashProvided": false,
        "expectedMemoryWrites": 0,
        "expectedOutcomeWrites": 0,
        "terminalReason": "instructions-sufficient"
      },
      "rationale": "Specialized github-actions-ci task with a frozen automatic-eligible match."
    },
    {
      "id": "auto-github-actions-ci-2",
      "scenarioClass": "automatic-relevant",
      "prompt": "Review a GitHub Actions pipeline for reliable continuous integration and safe delivery automation.",
      "explicitUserIntent": false,
      "invocationContext": "automatic",
      "expectedCatalogMatch": {
        "skillId": "github-actions-ci",
        "revision": "1.0.0",
        "revisionSha256": "6c5a32f336100a147b3af865f8a14713bd7f82a2810e1666ee49a679bef2c45c"
      },
      "expectedBehavior": {
        "search": "call",
        "load": "call",
        "operationSequence": ["search_skills", "load_skill"],
        "maxSearchCalls": 1,
        "maxLoadCalls": 1,
        "maxResourceCalls": 0,
        "resourcePaths": [],
        "repositoryHashProvided": false,
        "expectedMemoryWrites": 0,
        "expectedOutcomeWrites": 0,
        "terminalReason": "instructions-sufficient"
      },
      "rationale": "Specialized github-actions-ci task with a frozen automatic-eligible match."
    },
    {
      "id": "auto-github-actions-ci-3",
      "scenarioClass": "automatic-relevant",
      "prompt": "Create a CI workflow plan for pull-request checks and release delivery in GitHub Actions.",
      "explicitUserIntent": false,
      "invocationContext": "automatic",
      "expectedCatalogMatch": {
        "skillId": "github-actions-ci",
        "revision": "1.0.0",
        "revisionSha256": "6c5a32f336100a147b3af865f8a14713bd7f82a2810e1666ee49a679bef2c45c"
      },
      "expectedBehavior": {
        "search": "call",
        "load": "call",
        "operationSequence": [
          "search_skills",
          "load_skill",
          "read_skill_resource"
        ],
        "maxSearchCalls": 1,
        "maxLoadCalls": 1,
        "maxResourceCalls": 1,
        "resourcePaths": ["references/ci-checklist.md"],
        "repositoryHashProvided": false,
        "expectedMemoryWrites": 0,
        "expectedOutcomeWrites": 0,
        "terminalReason": "resource-consumed"
      },
      "rationale": "Specialized github-actions-ci task with a frozen automatic-eligible match."
    },
    {
      "id": "auto-node-api-design-1",
      "scenarioClass": "automatic-relevant",
      "prompt": "Review a Node.js REST API for compatible service interfaces, security, and clear endpoint design.",
      "explicitUserIntent": false,